{
  "version": "1.0.0",
  "accent": "en-US",
  "phone_set": {
    "model_repo": "facebook/wav2vec2-lv-60-espeak-cv-ft",
    "model_revision": "ae45363bf3413b374fecd9dc8bc1df0e24c3b7f4",
    "ipa_source": "espeak-ng 1.52.0 en-us via phonemizer, stress marks removed"
  },
  "review_status": {
    "english": "pending",
    "korean": "pending",
    "phonetics": "pending"
  },
  "entries": [
    {
      "entry_id": "r_l",
      "category": "consonant",
      "title_ko": "R과 L 구분",
      "title_en": "R vs L",
      "target_ipa": [
        "ɹ",
        "l"
      ],
      "why_ko": "한국어 ㄹ 하나로 영어의 r과 l을 모두 대신하기 쉬워서, right와 light가 비슷하게 나올 수 있어요.",
      "tip_ko": "l은 혀끝을 윗니 뒤 잇몸에 꼭 붙인 채 소리 내요. r은 혀끝이 입천장 어디에도 닿지 않게 살짝 뒤로 당기고, 입술을 조금 둥글게 모아 소리 내요.",
      "minimal_pairs": [
        {
          "pair_id": "r_l_01",
          "a": {
            "word": "right",
            "ipa": [
              "ɹ",
              "aɪ",
              "t"
            ]
          },
          "b": {
            "word": "light",
            "ipa": [
              "l",
              "aɪ",
              "t"
            ]
          }
        },
        {
          "pair_id": "r_l_02",
          "a": {
            "word": "rice",
            "ipa": [
              "ɹ",
              "aɪ",
              "s"
            ]
          },
          "b": {
            "word": "lice",
            "ipa": [
              "l",
              "aɪ",
              "s"
            ]
          }
        },
        {
          "pair_id": "r_l_03",
          "a": {
            "word": "road",
            "ipa": [
              "ɹ",
              "oʊ",
              "d"
            ]
          },
          "b": {
            "word": "load",
            "ipa": [
              "l",
              "oʊ",
              "d"
            ]
          }
        },
        {
          "pair_id": "r_l_04",
          "a": {
            "word": "rock",
            "ipa": [
              "ɹ",
              "ɑː",
              "k"
            ]
          },
          "b": {
            "word": "lock",
            "ipa": [
              "l",
              "ɑː",
              "k"
            ]
          }
        },
        {
          "pair_id": "r_l_05",
          "a": {
            "word": "pray",
            "ipa": [
              "p",
              "ɹ",
              "eɪ"
            ]
          },
          "b": {
            "word": "play",
            "ipa": [
              "p",
              "l",
              "eɪ"
            ]
          }
        },
        {
          "pair_id": "r_l_06",
          "a": {
            "word": "fry",
            "ipa": [
              "f",
              "ɹ",
              "aɪ"
            ]
          },
          "b": {
            "word": "fly",
            "ipa": [
              "f",
              "l",
              "aɪ"
            ]
          }
        },
        {
          "pair_id": "r_l_07",
          "a": {
            "word": "grass",
            "ipa": [
              "ɡ",
              "ɹ",
              "æ",
              "s"
            ]
          },
          "b": {
            "word": "glass",
            "ipa": [
              "ɡ",
              "l",
              "æ",
              "s"
            ]
          }
        },
        {
          "pair_id": "r_l_08",
          "a": {
            "word": "wrong",
            "ipa": [
              "ɹ",
              "ɔ",
              "ŋ"
            ]
          },
          "b": {
            "word": "long",
            "ipa": [
              "l",
              "ɔ",
              "ŋ"
            ]
          }
        }
      ],
      "practice_sentences": [
        {
          "sentence_id": "r_l_s1",
          "en": "The light on the right is red.",
          "ko": "오른쪽 불빛이 빨간색이에요."
        },
        {
          "sentence_id": "r_l_s2",
          "en": "Please collect the glass from the grass.",
          "ko": "잔디 위에 있는 유리잔을 치워 주세요."
        }
      ]
    },
    {
      "entry_id": "f_p",
      "category": "consonant",
      "title_ko": "F와 P 구분",
      "title_en": "F vs P",
      "target_ipa": [
        "f",
        "p"
      ],
      "why_ko": "한국어에는 f 소리가 없어서 ㅍ으로 바꿔 말하기 쉬워요. 그러면 fan이 pan처럼 들릴 수 있어요.",
      "tip_ko": "윗니를 아랫입술 안쪽에 가볍게 대고, 그 틈으로 바람을 길게 내보내요. p는 두 입술을 붙였다가 한 번에 터뜨리는 소리예요.",
      "minimal_pairs": [
        {
          "pair_id": "f_p_01",
          "a": {
            "word": "fan",
            "ipa": [
              "f",
              "æ",
              "n"
            ]
          },
          "b": {
            "word": "pan",
            "ipa": [
              "p",
              "æ",
              "n"
            ]
          }
        },
        {
          "pair_id": "f_p_02",
          "a": {
            "word": "fast",
            "ipa": [
              "f",
              "æ",
              "s",
              "t"
            ]
          },
          "b": {
            "word": "past",
            "ipa": [
              "p",
              "æ",
              "s",
              "t"
            ]
          }
        },
        {
          "pair_id": "f_p_03",
          "a": {
            "word": "fine",
            "ipa": [
              "f",
              "aɪ",
              "n"
            ]
          },
          "b": {
            "word": "pine",
            "ipa": [
              "p",
              "aɪ",
              "n"
            ]
          }
        },
        {
          "pair_id": "f_p_04",
          "a": {
            "word": "fool",
            "ipa": [
              "f",
              "uː",
              "l"
            ]
          },
          "b": {
            "word": "pool",
            "ipa": [
              "p",
              "uː",
              "l"
            ]
          }
        },
        {
          "pair_id": "f_p_05",
          "a": {
            "word": "fork",
            "ipa": [
              "f",
              "ɔːɹ",
              "k"
            ]
          },
          "b": {
            "word": "pork",
            "ipa": [
              "p",
              "ɔːɹ",
              "k"
            ]
          }
        },
        {
          "pair_id": "f_p_06",
          "a": {
            "word": "face",
            "ipa": [
              "f",
              "eɪ",
              "s"
            ]
          },
          "b": {
            "word": "pace",
            "ipa": [
              "p",
              "eɪ",
              "s"
            ]
          }
        },
        {
          "pair_id": "f_p_07",
          "a": {
            "word": "wife",
            "ipa": [
              "w",
              "aɪ",
              "f"
            ]
          },
          "b": {
            "word": "wipe",
            "ipa": [
              "w",
              "aɪ",
              "p"
            ]
          }
        },
        {
          "pair_id": "f_p_08",
          "a": {
            "word": "leaf",
            "ipa": [
              "l",
              "iː",
              "f"
            ]
          },
          "b": {
            "word": "leap",
            "ipa": [
              "l",
              "iː",
              "p"
            ]
          }
        }
      ],
      "practice_sentences": [
        {
          "sentence_id": "f_p_s1",
          "en": "I need a fork for my pork.",
          "ko": "돼지고기를 먹을 포크가 필요해요."
        },
        {
          "sentence_id": "f_p_s2",
          "en": "The first flight was fine.",
          "ko": "첫 비행은 괜찮았어요."
        }
      ]
    },
    {
      "entry_id": "v_b",
      "category": "consonant",
      "title_ko": "V와 B 구분",
      "title_en": "V vs B",
      "target_ipa": [
        "v",
        "b"
      ],
      "why_ko": "한국어에는 v 소리가 없어서 ㅂ으로 바꿔 말하기 쉬워요. 그러면 very가 berry처럼 들릴 수 있어요.",
      "tip_ko": "f와 같은 입 모양(윗니를 아랫입술에 가볍게 대기)에서 목을 울리며 소리 내요. 목에 손을 대면 떨림이 느껴져요. b는 두 입술을 붙였다가 떼는 소리예요.",
      "minimal_pairs": [
        {
          "pair_id": "v_b_01",
          "a": {
            "word": "vest",
            "ipa": [
              "v",
              "ɛ",
              "s",
              "t"
            ]
          },
          "b": {
            "word": "best",
            "ipa": [
              "b",
              "ɛ",
              "s",
              "t"
            ]
          }
        },
        {
          "pair_id": "v_b_02",
          "a": {
            "word": "very",
            "ipa": [
              "v",
              "ɛ",
              "ɹ",
              "i"
            ]
          },
          "b": {
            "word": "berry",
            "ipa": [
              "b",
              "ɛ",
              "ɹ",
              "i"
            ]
          }
        },
        {
          "pair_id": "v_b_03",
          "a": {
            "word": "van",
            "ipa": [
              "v",
              "æ",
              "n"
            ]
          },
          "b": {
            "word": "ban",
            "ipa": [
              "b",
              "æ",
              "n"
            ]
          }
        },
        {
          "pair_id": "v_b_04",
          "a": {
            "word": "vote",
            "ipa": [
              "v",
              "oʊ",
              "t"
            ]
          },
          "b": {
            "word": "boat",
            "ipa": [
              "b",
              "oʊ",
              "t"
            ]
          }
        },
        {
          "pair_id": "v_b_05",
          "a": {
            "word": "curve",
            "ipa": [
              "k",
              "ɜː",
              "v"
            ]
          },
          "b": {
            "word": "curb",
            "ipa": [
              "k",
              "ɜː",
              "b"
            ]
          }
        },
        {
          "pair_id": "v_b_06",
          "a": {
            "word": "vet",
            "ipa": [
              "v",
              "ɛ",
              "t"
            ]
          },
          "b": {
            "word": "bet",
            "ipa": [
              "b",
              "ɛ",